[
  {
    "name": "sodium",
    "id": "AANobbMI",
    "provider": "modrinth",
    "fallback": [
      {
        "minecraftVersion": "1.17.1",
        "versionId": "6YGRDUVT"
      },
      {
        "minecraftVersion": "1.18",
        "versionId": "3JJvf9Kn"
      }
    ],
    "dependencies": [
      "AZomiSrC",
      "hEOCdOgW"
    ],
    "config": "sodiumDir"
  },
  {
    "name": "litematica",
    "id": "308892",
    "provider": "curseforge",
    "fallback": [],
    "dependencies": [
      "303119",
      "244260"
    ]
  }
]